1285	医院,看到这样的两个人,在急诊室门口拿着缴费单数硬币,一个,两个,衣裳里的小包袱里还有五个,摄影者写道:在一个百年不遇的国度里百年不语。【转】不加配图画面自行想象	anger
1286	一个人自愚自乐久了,愚就多于乐了,所以交流是很有必要的。交流一人,胜造七级浮屠	anger
1287	我爱你,因为你能唤出,我最真的那部分。我爱你,因为你穿越我心灵的旷野,如同阳光穿透水晶般容易,我的傻气,我的弱点,在你的目光里几乎不存在。[爱你]	like
1288	公司表彰优秀员工,没有我呢,老公说不怕,他会发我一个最佳老婆奖,奖品就是老公一个,好温馨,↖(^ω^)↗,我的奖品最丰厚!爱你	like
1289	学习工作两都误,说真的,快弄死我吧。[生病][生病][泪][泪]	fear
1290	为自己为将来为狗狗	like
1291	你们有悄悄关注的人呢吗?!想半天,自己都没有一个悄悄关注的人!好想有悄悄关注的人!	disgust
1292	真的觉得你很好,难道仅仅是因为初恋?	sadness
1293	这种天,到底是应该开灯还是拉开窗帘?	fear
1294	如果不能在一起,就不要给对方任何希望任何暗示,这才是最大的担当;分开了,不去打搅让对方安然生活,这才是最后的温柔。	sadness
1295	发一条微博,记念我的头发	sadness
1296	不知怎么回事最近真的不管是啥都爱→→哈哈哈哈哈哈哈哈哈哈哈哈哈哈哈哈哈哈哈个没玩没了估计别人看到会以为我是傻子吧--	happiness
1297	他妈stefen就是个悲剧但我他妈的就一直沉浸在一开始stefen和elena那掏心掏肺的爱情中我一直爱着的善良天真stefen啊啊啊现在大结局他妈的你让silas那死怪咖变成我stefen然后让他沉落海?我顶你人地有老婆你都唔洗甘样cut人地d戏咖!现实中ian和nina又分!手!了!叫我怎么看下去感觉不会再爱了	anger
1298	自来熟和装熟区别可能在于:自来熟主攻帮助、陪同、协作、赞扬、不八卦的关心等积极易接受的方面;装熟主攻隐私、自认为了解、替人做决定以及学韩剧男主套路也不先照照镜子等让人易翻脸的方面。女生自来熟是活泼外向,装熟是脸三心十的八婆;男生自来熟是开朗大方,装熟是猥琐的恶心伎俩。[愤怒]	disgust
1299	不是都说女儿是爸爸上辈子的情人吗?所以我跟我妈妈有时看不惯就说得通了嘛,谁叫我们是情敌呢!	happiness
1300	其实我不快乐	sadness
1301	很久没有郁闷这种情绪了,但今天还是郁闷了。我老家的表姐自己辛苦打工,供儿子读了大学,托人帮他找到好工作,又借钱给他买房娶媳妇,还给他一部旧车。可她的儿子不仅不帮助她还债,现在又要她去贷款换新车,“因为新生小孩需要”。	sadness
1302	凭什么冻结我的账号!!![狂抓][狂抓][狂抓]@新浪@微博微博小秘书	sadness
1303	高考完每天这时候我一定要天天出来和老大散步穿大短裤!	happiness
1304	对这样的游戏,我累了。。。你且还乐此不疲。。。	sadness
1305	郁闷,有些人大放假的上神马班搞的我这会儿很无聊[抓狂],[哼]认得的人都米有注册微博的	disgust
1306	2013,你好[心]各位亲爱的朋友们新年快乐!加油努力考上理想大学![拳头]今年要圆两个梦[太阳]哇咔咔!!	like
1307	爸妈带着小多多回西宁去了,回到家里空荡荡的,心里说不上是什么滋味,真的好难受啊!我想你们。	sadness
1308	爱,就是要在一起。	happiness
1309	那么那么多人吸烟,于是被迫吸了很多二手烟。咳的不行!还有随处可见的垃圾,尼玛就不能够丢垃圾桶吗?明明就近在眼前啊!我心中无比愤怒,却还得微笑着说!	sadness
1310	如果你很想我、应该早就来找我了	sadness
1311	不能醉、因为没有人让我依靠。 不能倒,因为没有人会扶。 我知道一个人、要坚强。	sadness
1312	【快报】雷军持有小米77.80%股份,身价或超马云成为亚洲新首富→_→2013年小米营收约265.83亿元,营利约4.86亿,利润总额约5.24亿,净利约3.47亿元。目前小米正在进行新一轮融资,投资方极有可能是鼎鼎有名的dst。如果小米估值高达500亿美元,雷军身价则以近390亿美元超马云问鼎新首富。	like
1313	待我把乱七八糟的事情搞定	happiness
1314	就是午觉睡醒有人给带吃的回来。[哈哈](是不是有点没•••[哈哈]	happiness
1315	我不讨厌任何人,即使是可以称之为讨厌的人也根本就入不了我的心,所以根本不能称之为讨厌。	disgust
1316	本命年了,没人送的话我就自个儿买个红链子绑着[可怜]	sadness
1317	么么哒gyz	like
1318	在别人上学的时候睡觉是件多么灿烂的事阿	happiness
1319	想听你的声音,可找不到打电话给你的理由,而你也从来不会主动联系我,于是本就因分隔两地而疏远的我们,对彼此更加陌生。不过,在这个不算静的清晨,我又想起你了...	sadness
1320	原来怀孕的是你一女一直在备孕,可以一直也没怀上。一天他去见了一个朋友,朋友见她长得比以前胖了,就开心的问:几个月啦?那女忙解释说:还没呢。朋友说:这种事不要不好意思,又没什么的。这件事搞得那女的心情一阵低落,结果过了几天发现是朋友自己怀孕了,苍天啊。	sadness
1321	徐志森:你觉得你能干什么?陆涛:我觉得,只要我愿意,什么都能干。	like
1322	我又跑去costa挂失会员卡,在知道了我的身份证号和姓名之后告诉我:你要是不知道卡号我们就无法帮你挂失。我要一杯冰咖啡不加冰块做成常温的,多容易的事情,他却说我无法不加冰,只能少加,我说那你给我做热美式,然后加冰块,他说这可以。当时我就想问他:弟弟,听说过加法交换律吗?	anger
1323	我的假期马上结束了啊。。。。	like
1324	到单位开完会,写好材料,走出所在所门口,一位小姑娘指着我,对她的妈妈说,妈妈那叔叔是我们欣欣幼儿园的警察,他来我们幼儿园上过课,我笑笑的抚摸她的头,夸奖了几句,不知为啥,心里有些感动,突然觉得再多的辛劳是值得的,只为了守护这些可爱的孩子![嘻嘻]祝亲们端午节日快乐!	happiness
1325	熬夜!!我又给了自己打乱内分泌有机会变丑的机会!!	anger
1326	病菌很讨厌,生病很讨厌,咳嗽也很讨厌,感冒也非常讨厌,最讨厌的是这样的话说出来都还是要生病。	disgust
1327	3点了,在我看来,你过得很好,我也更早睡了。还是希望着你醒悟。这希望就是我这等待么。我也不知道。[熊猫][熊猫][熊猫]	like
1328	想吐的冲动有木有最近喉咙好干睡觉都挺碍事	disgust
1329	我将很快随你而去。	sadness
1330	是该抽个时间回去了不能让你们等那么久[c委屈]	sadness
1331	夏天到了	happiness
1332	有时回忆起原来断断续续的画面,觉得不是我,那是潜伏在我身体里的另一个我。那不是真实的。	sadness
1333	时间一长,民众会忘记自己是国家的主人,学生会忘记自己是学校的主人。若上层下达指令,即使不可理喻也只能逆来顺受,大环境如此,小环境就更不用提了。	sadness
1334	改变只是时间问题。[奥特曼]	like
1335	是一个伟大的发明每次看到不知道该怎么评论的东西时我就会默默点一个赞	like
1336	没心没肺旳、笑[哈哈][哈哈][哈哈][哈哈][哈哈][哈哈]	happiness
1337	看奋斗,觉着自己还是很年轻的。	like
1338	现在心情特不爽,这么晚了还是睡不着,蚊子在旁边飞的难受,天热的也难受,在这样的宿舍手机信号不给力,用了一兆了,一个微博都木有刷成功,崩溃了[抓狂][抓狂][抓狂][抓狂][抓狂][抓狂][抓狂][抓狂][抓狂][抓狂][抓狂][抓狂][抓狂][抓狂]	anger
1339	未来要靠自己创造[蜡烛][蜡烛][蜡烛]	like
1340	一首不破录得我快死了	anger
1341	▲凌俊浩▲	like
1342	快要疯了我,都这个点了,还没睡着。[熊猫]	like
1343	曾经你以为一些人可以深信,到头来却是自己一厢情愿。然后你会发现,自己才是最值得相信的人。	anger
1344	鱼忘七秒,他几秒后忘记他自己是鱼。	sadness
1345	开始做作业了!哈哈[玩去啦][哈哈]正好要用电脑,我可以上一天网了!!!!	happiness
1346	这尼玛。。都见光到这个地步了吗。。。我这颗小心脏昂。。。尼玛。。。大爷没化妆啊。。摔。。真是一点儿脸不给留昂。。。妈蛋。。。这尼玛。。。	surprise
1347	睡了午觉下午一直都是小宇宙爆发状态	happiness
1348	今天是开心百科开通的第一天,快乐分享从今天开始。独乐乐不如众乐乐,祝大家天天开心。	happiness
1349	寝室再度被通报了!!!难过了!!!怎么就这么倒霉,恰巧今天没收,就被检查了!晕死,有必要那么较真地检查吗!!有必要吗!!!哼............再通报,我们的门,都别想再进...把门卡住,看你怎么检查!!	sadness
1350	想念你,却又见不到你,只因你已出发去旅游,而我却还要工作	sadness
1351	想念是一种无能为力的伤痛。身若不远行心必远行。	sadness
1352	听到某天一起唱的一首歌,画面好清晰。突然觉得害怕,会不会人生再也没有交集,会不会再也不会见面,不能这样不能这样。我不想改变自己的信念,从以前到现在,我都只想做我喜欢的事,我的却不曾想过,这样别人会不会喜欢,可我又觉得,自己都没顾好,又怎么去顾及别人,所以我决定,奋不顾身。	sadness
1353	[爱你]有一个爱我的人比什么都强,耍朋友是两个人的事,爱不爱你你知道,爱不爱我我亦清楚。estamosjuntosdeochomeses,felizdeochomeses,teamo[心][心][haha][haha]	like
1354	外面的东西真难吃!好想回家啊啊啊!可是我才离开家几个钟而已,然后下班又要回去的,哎	disgust
1355	蟑螂真的赶走了吗?	like
1356	人蚊大战!	anger
1357	是否能再重来.........等待,永久的等待。[抓狂][悲伤]	sadness
1358	爱就大声说出来,因为你永远不知道,明天和意外那个会先来。	like
1359	这一天一天的,真想赶紧摆脱这样的生活。	sadness
1360	不知道为什么,感觉学习好累,不想学习,没有动力,发小的话持续了十几分钟又倒下了,贱人慢慢淡了,贱人的作用也没有了,哪位神来救救我啊~~~~无心的孩纸伤不起	sadness
1361	这个坏掉的微笑的苹果,在跟世界说,dear,gnite~	like
1362	奶奶,妈妈问我看着您受苦心里难受吗?我没说话。我也知道您在受苦,但是就不想让您离开,您就是我心灵的寄托。我童年少年青年时代的欢乐全都有您的参与,我知道,没了您,我再也不会有那样快乐的感觉。离不开您,离不开您。	happiness
1363	刚才一边吃橘子一边擦手一边弄草图大师,结果差点把草纸给吃了t^t	anger
1364	起床不知道干什么,生活没有一点兴趣。我抛弃生活,也被生活抛弃	disgust
1365	好了,现在我是西门大嫂的死忠粉了,拽我我也不走了。[bm可爱]	disgust
1366	我在这里,别找不到我,[害羞][害羞]	like
1367	我不喜欢现在的生活每天重复着一件事,但是现实告诉我必须这么做!!!	sadness
1368	早上等公交,问一位裹的巨严实的协管,阿姨,-公交啥时候来呀---,人家用地道的北京爷们儿腔,热情的回答-刚过去一辆,多等会吧。原来是个男嗒[吃惊]-	disgust
1369	直到年末好几帮guizi来,一天也不让姐闲着,你妈了个b的,来赶山的吗你们。	anger
1370	整理微博删了好多东西	happiness
1371	小清新明天就七个月了,好快,越发可爱了,喜欢出门,喜欢洗澡,喜欢喝水,喜欢笑,宝贝,再有五个月你就会说话会走路了,很是期待你走路的样子,也很期待你叫的“妈妈”[呵呵]	happiness
1372	今天正式上课了,好期待[哈哈][哈哈][赞]	happiness
1373	侯,把自己的理想当做奋斗的目标,尽管不太现实。因为会告诉自己,我一定要实现自己理想,不然这辈子没乐趣会后悔。这应该是大家内心所想的,也是陆涛所想的。但我们的理想往往跟剧中的一样,不那么现实。总会吵着:我要什么我要什么。但我们的理想不应该让别人来买单。当我们讨厌剧中角色的—	like
1374	太阳出来有4天。	happiness
1375	一句晚安换我一夜心安。	like
1376	命里无强求	sadness
1377	有没有什么三观正常单纯正经一点的少年漫推荐............	sadness
1378	有些人的匡威后鞋帮瘪瘪的,一看就是曾被趿着当拖鞋穿过。好想拉住这些人说「哥们儿我们是一国的」。	disgust
1379	正想关机,好友来电话。耐心听完,我说哥们儿啊我常年生活在海南,你问我如何让水快速变凉如何让自己凉快我倒是有方法若干,反之,我惭愧学识浅薄啥主意想不出。现在科技发达,上网搜吧,办法也好用品也罢一搜一萝筐,有真的也有假的,别被蒙了就好。就不能问点我喜欢的问题比如吃呀花呀吗[生病]	sadness
1380	龙凕和凌波的最后......还有乌鸦嘴和瑕的对白tt	sadness
1381	板子你怎么了!!你酷爱活过来好不好!我还有好几张图没画啊板子君!!!你想让我被一群痴汉群殴吗!!!^p^	anger
1382	谢谢你一直谦让我,忍受我!对不起!	sadness
1383	幸福其实很简单,学会满足很重要,虽然我只是一个孩子但是,我被幸福包围着,我爱我的妈妈,爱我的爸爸,ta们给了我幸福的生活,有时还是会和爸妈吵架,但是我会后悔我的举动,对于我来说幸福就是珍惜现在的一切,珍惜我那美好的童年,我希望没个人都感受到幸福,其实幸福就在你身边用心发现吧	happiness
1384	我家的小帅哥!@[睡觉][抓狂][嘻嘻]	happiness
1385	我们住的房屋越来越大了,但孩子的成长空间越来越小了。我们对别人有了更多的妥协馀地,可是给孩子的时间却一再减少。我们拥有了更多的知识,有时在孩子面前竟也是如此的无知。	disgust
1386	大家都知道火车上有售货员卖水果什么的,有一屌丝男问:有橙子吗?售货员说:有!屌丝又问:我没刀子怎么切?(火车上是不能带刀具的)售货员说:我有!屌丝又问:用刀要钱不?售货员说:不要。屌丝说:那你把刀子借我!然后华丽的拿出包里的橙子......当时笑喷一片,售货员那个满脸黑线啊......	disgust
1387	俞灏明。[心]	happiness
1388	最讨厌别人翻我东西,翻东西无所谓,好歹翻过恢复原样好不,本来想睡觉的我又郁闷了	sadness
1389	开心消消乐这个游戏好好玩[嘻嘻]	happiness
1390	我的kappa的那个t恤在外面凉着不知道被谁拿走了!	sadness
1391	我今天彻底“杯具”了。。。。。	sadness
1392	理解包容沟通狗屁。	anger
1393	回来上班,同事例行寒暄之后认真提的第一个问题是“你短时间内不会去休产假的吧?”......=_=我不在家这半个月哪里怎么了么......	disgust
1394	想念,很无力,因为看不到想念的结果。 也许,根本就不需结果, 它只是证明在心里有个人曾存在过。能否给想念一份证书, 证明它曾存在过?	sadness
1395	搭坏车、考试无精神、连党你都坑我......[泪]	sadness
1396	我的信仰就是你	anger
1397	已经连续两天煮咖啡煮糊了[泪]现在咖啡壶还一股糊味儿[泪]	sadness
1398	你好,我就好。	happiness
1399	haizz..whatthefuck!!!![怒]	anger
1400	竟。然。找。不。到。戒。指。了。[泪]	sadness
1401	",没有你,我怎么办?你是我一生中见过的最好的人,我最好的朋友。"	like
1402	每次看到brouwer的姓都会想起布哥,看到neuvirth会想起老诺......我就不说他首都小门姓holtby了......	disgust
1403	如果有一天我跟一个比你好的人走了	sadness
1404	今天我爸载了一个客人到了目的地客人就问我爸多少钱我爸说35结果那个人却说没有钱怎么办我爸就好奇了问她怎么了她说被人骗了骗光了她所以的钱当时我爸看她挺着大肚子就自认倒霉了可是我更好奇的是是我爸被她骗了还是她真是没钱!!!	surprise
1405	错过就是错过错过就是一辈子,过错错过	sadness
1406	lol看着一群人互掐我都要笑尿了[困死了]	anger
1407	居然还有很多人一边攻击意大利一边为苏亚雷斯说话。。。	disgust
1408	其实昨半夜的那个问题是个轻松的试探,得到的却是一个让人.........总之,有在乎自己的人就够了。	sadness
1409	我这么个万年潜水党徒的微博号也有人盗?真服了你们了。	anger
1410	龚沁宇是傻逼傻逼傻逼傻逼傻逼傻逼傻逼!!!!!!!	anger
1411	移动的号太邪门了,一停机就不让上网。完全比不上联通。最主要是,发不了几条短信就没钱了。最最重要的是,尼马停机短信都不能收。太坑了。	sadness
1412	轻松的两天度过了,开启刻苦模式。。五天后再见。。[可怜]	like
1413	我本来觉得现在我能起来刷微博已经很不错了,后来发现还有一个比我更早的	anger
1414	我们班男生有一个爱好,爱在厕所开会。如果你不愿意去,很好众男生各种骚扰。没想到老师今天居然发狠了,拿着把扫帚直冲男厕。我有幸看见男生鸡飞狗跳地逃跑过程,默叹。老师你甚霸气。[吃惊]	surprise
1415	不想做三角函数	disgust
1416	终于把之前的手机里的照片都整理好了[拜拜]终于把人人里有关论文、答辩的收藏给删掉了[拜拜]!!!	happiness
1417	心情不好时,有时会觉得自己是被所有人所遗忘的人,心情好时会觉得自己拥有了整个世界。	sadness
1418	在学校都这个点睡现在想困高紧明天起早点写作业第一个星期作业就多个要命认真写作业啊现在我除了读书还能干什么!	sadness
1419	像是决定了以后都要在一起一样向着一个方向一直努力呢。	like
1420	流了好几次泪,是感动,还是感动	happiness
1421	原版掉色哎~咋着都是3-4百大洋一条的裙子哎~真无语了	anger
1422	【杰出人士的六个好习惯】1、凡事第一反应:找方法而不找借口。2、写下来,不要太依靠脑袋记忆。3、每天提前15分钟上班,推迟30分钟下班。4、恪守诚信说到做到。5、不管任何方面每天必须“进步一点点”6、每天在下班前15分钟的时间做一天的整理工作。没有做到的,从现在开始坚持做到!	like
1423	对不起我要真的不再用心了,以后我们只会缝场做戏了,对不起,我要保护自己,	sadness
1424	我去旅游的那天奶奶住院了,前天才刚出的院[衰]一大早起来上班才知道奶奶又不舒服了!是不是人老了都是这样	sadness
1425	一个人总是仰望和羡慕着别人的幸福,一回头,却发现自己正被仰望和羡慕着。其实,每个人都是幸福的。只是,你的幸福,常常在别人眼里。每一个人都是幸福的,不用羡慕别人,做最好的自己。爱自己。[太阳][太阳][太阳][太阳]	happiness
1426	[吃惊]今天看见两个人都拿着相机拍照,一个是在公交站牌拍照的,一个是在社区里拍照的	surprise
1427	女人拒绝男人有三招:1、借钱,2、素颜,3、素颜去借钱。如果还有人追你,哎呀那绝对是真爱!绑匪来电话:“你老婆在我手上,24小时内凑到1百万,不然我撕票。”老公:“钱没问题,但是能不能晚几天给你?”劫匪:“为什么?”老公:“我想清静几天。”劫匪:“两百万,不然马上放人。”	happiness
1428	某次坐出租,半路一美女招手,要拼车,司机停了,我想能跟这样一美女同路,拼就拼吧,没想到司机说:你下车吧,刚带你的那段不要钱了。。。	happiness
1429	我觉得好难过呀。	sadness
1430	大号果然是不安全的。。。	surprise
1431	一个人被认可的籍贯通常是这样,你爸爸妈妈是b地人,你在a地出生长大,如果你成功了,类似某奥运冠军,那一刻起你才会变成a地人,如果你穷困潦倒脏兮兮地去挤地铁,跟别人吵起来,别人就会说哎呀他们b地人都是这个样子,没素质!	happiness
1432	看着电磁炉和电饭锅里面冒出的烟好有家的感觉幸福不一定要荣华富贵只要和自己喜欢的人在一起共同准备一顿日常的晚餐就可以[爱你]	happiness
1433	我有一弟,馀嘉涵。我有一侄,黄奕晨。都是一岁左右的年纪。馀兄打电话时,总被教大叫'亮哥',直至不小心按到座机某不明位置,直到电话挂断,惹得老妈再来通湖北到山东的热线。我估计他或者认为'亮哥'应该就是部红色电话。黄侄每每见面只会傻傻地盯着我,痴痴地笑,直到我惹得去玩躲猫猫。	sadness
1434	相信时间的速度还有整整两年了不知道那时候的我会是什么模样最近学习状况不好期末考试要是再考不好被t出重点还拿什么脸见别人要是名次在同桌后面请他吃饭你甘心便宜那家伙吗所以说我决定今晚奋斗一把弥补之前的准备战斗迎接期末[奥特曼][奥特曼][奥特曼]	like
1435	刚刚那一幕我魂都吓没了!!!永远记住今天。	sadness
1436	今天出版社的编辑告诉我,我的两本书稿已经通过选题,下周就能收到正式的合同,并告诉我,在这期间再进行一些修改,等到正式签完合同,就可以把电子版发给她,她们这边就可以开始做三审三校了。	happiness
1437	今晚和这小调皮玩。。听话啊你。让我省点心。暑假一个多月。暴走	disgust
1438	第一天来这里还不熟悉路无聊的我无奈的生活	disgust
1439	雅雅转文了	anger
1440	dv创作原来是纪录片创作啊,我真是孤陋寡闻了呀。	anger
1441	峰回路转峰回路转峰回路转九曲十八弯十八弯这里的山路十八弯~这里的......	anger
1442	永远都是情绪破坏者,说翻脸就翻脸,你在家呆着,别人大气都不敢喘。每回家就压抑着,如阴云密布。记着,哪里有压迫哪里就有反抗。	anger
1443	不是星期一上课[挖鼻屎]	surprise
1444	“我娘有曰:三人行必有我夫,择其帅者而嫁之”“流言止于智者,聊天止于呵呵”	happiness
1445	这样的赶脚让我心里无底,时不时的就来吓自己,但愿是我想多了,会没事儿的,一定会的!	sadness
1446	极其值得信任,有执行力的sic绝对是operations的福气,公司的福气!能不能把某位爱周游全球的人copy一下分到全国各地?	sadness
1447	我把好多人忘记了···	sadness
1448	前晚此时,偶然听到爷爷闷闷的呻吟,心里沉沉的难受。恨不能代爷爷受疼,只能在他说“惦念”时回一趟家陪他说说话。还是要每天笑着[嘻嘻],这样回家时也可以快乐地对爷爷奶奶笑。时日无几,以后太远,愿弗悲“树欲静而风不止”。	sadness
1449	腿瘦了一圈脸和腰胖了三圈,怎么破?难道我要每天催眠自己“美不美看大腿”。。。	disgust
1450	有没有那么一天,你突然回头,我们有狼狈的撞在一起	sadness
1451	遗传学考完啦,心情大好,至于结果,管他呢,就是酱紫没心没肺[哈哈]问好?呵呵,好怎样,不好又如何,这种艾特像是群发的短信,懒得回复[睡觉]对于千年不换头像的我在昨天把所有社交软件头像都换了可谓是一个奇迹,没原因[挖鼻屎]偶然发现的微数据,常互动,真的么?[呵呵]『回笼觉睡起』	happiness
1452	上两次回家,是精神上出了点不大不小的毛病。没感觉高兴。这次会家,是很高兴,一者要看到父母和儿子,还有那魂牵梦萦的山水,二者我精神愉悦,已是健康者!能不高兴吗?	happiness
1453	就是一个笨蛋爱上了一个傻子	happiness
1454	☞嘻嘻嘻嘻嘻嘻嘻嘻嘻嘻嘻嘻嘻嘻嘻嘻嘻嘻嘻嘻嘻嘻嘻嘻嘻嘻嘻嘻嘻嘻嘻嘻嘻嘻嘻嘻嘻嘻嘻嘻嘻嘻嘻嘻嘻嘻嘻嘻嘻嘻嘻嘻嘻嘻嘻嘻嘻嘻嘻嘻嘻嘻嘻嘻嘻嘻嘻嘻嘻嘻嘻嘻嘻嘻嘻嘻嘻嘻嘻嘻嘻嘻嘻嘻嘻嘻嘻嘻嘻嘻嘻嘻嘻嘻嘻嘻嘻嘻嘻嘻嘻嘻嘻☜	happiness
1455	心都在滴脂肪啊。。。	happiness
1456	又发火又发火又发火你他妈克制一下会死吗吵完还后悔毛阿来不来得及阿怎么不去死啦你	sadness
1457	其实我没有那么好,因为我有一颗嫉妒之心	sadness
1458	加图索接受天空体育采访谈自己被牵扯进最新一期赌球案调查一事:我希望澄清一点,我这一生中从未参与过赌球,就算我想参与也不知道其中的门道。如果检方最后认定我有罪,那我会找一个公众场合在所有人目前自杀谢罪。我不是这种人,平时我都不和朋友们一起踢球,因为我痛恨失败。	anger
1459	想围个脖来表达我喜悦的心情怎么就觉得好词穷捏这到底是为什么捏这大年初一的多喜庆的日子啊这冷飕飕的天气真不想去串门啊去串门了啊	disgust
1460	中国人民大学!!!!!!!!!!!!!!我来啦!!!!!	like
1461	聚尼玛的会,花钱把自己搞得像个狗、	anger
1462	笑得连自己都觉得恶心	happiness
1463	今天的总结两字[泪][泪][泪][泪][泪][泪]	sadness
1464	你有信心,我才安心。[爱你]	sadness
1465	总有那么多想不明白的,世界之大为何我们相遇。操蛋的,一句唱出了我的想法![话筒]	anger
1466	不开心的时候就喜欢单曲循环	sadness
1467	希望你,你实习快乐	like
1468	每个人刚开始都接受不了这样的事实:那个发誓永远不会欺骗、背叛、伤害自己的人有一天却违背了他的诺言!可是看得多了、遇见的多了、想的开了就开始又明白了:感情本来就是这样,没有法律规定一个人非要忠诚于另一人,你的忠诚只是你自己的一厢情愿!	sadness
