2537	我很想你很想	disgust
2538	早餐有豆浆[做鬼脸][做鬼脸][做鬼脸]	happiness
2539	没心没肺,晚安[失望]	sadness
2540	高贵的情绕道,这里没地方让你摆架子!...[bm得瑟]	disgust
2541	当你满腹情感,想要向对方表达你的思念和依赖,往往被泼冷水,因为对方与你不在一条情感线上,很难引起共鸣,因此付出情感多的总会失魂落魄,看淡点,生活还在继续。	sadness
2542	如此幸福的梦现实难再重来话说多了都是眼泪	sadness
2543	辜负真心的人,一辈子会内疚。	sadness
2544	话说,在椅子上一挪动就会发生响声,像放屁一样......那不是放屁啊,别用那种眼神看我......	disgust
2545	我和你的五个月我很想你,所以我想我们可以继续幸福。我知道你不会评论,你说不要删掉为你写的任何一条微博,可惜幸福太过于不易。这次,我愿做一个等待者,但我不知道我还能坚持多久	sadness
2546	想过简单开心快乐的生活[礼物][礼物]	happiness
2547	因为有死亡,我们才会如此倾心去爱一个人,要不是有离别,我们也不会如此珍惜相聚的时光。相聚和离别本来就是一对,一如爱和恨,向来形影相吊。	like
2548	8年前的清明,病床上的爷爷还在为了上坟而纠结,最后不得已嘱托大儿子就在堂屋让他听见的情况下预先替他烧纸。可谁知,就在第二天4.5晚上,就离我们而去!我是被爷爷奶奶带大的,从小就是他俩接送。一直到我成年,才能算是真正脱离他们。没有文化的他们,却教我写字算术。一个打我,另一个护我。	sadness
2549	也许过去的早已遥遥无期,也许剩下的已经望尘莫及,但也许只是也许而已。	sadness
2550	最近手机端抽风越来越严重了...居然昨天发的微博今天才发出去......	disgust
2551	ok.lby,iamcoolinmyface.thankyouforinsistingaskingmeaboutmybreadfast."老大你要吃什么?"你现在饿吗?我有八宝粥。"好吧,小感动了,在我要去附一面试的今天谢谢你那么关心我让我有更多时间做面试准备。	happiness
2552	别拿专业水平来要求我,一来你给我专业水平那么多钱吗?二来我要有那水平我做现在这活干嘛?三来想要好的你花钱找人做啊,不想花钱还想要最好的你真是在白日做梦啊!	sadness
2553	有人说“快乐”是种很重要的东西,为什么我把得到块状的玩具也没得到快乐	happiness
2554	她离开之后,所有的事情好像改变了。就像一首歌被抽去了最高的一个音符,在最尴尬的地方,戛然而止。	disgust
2555	我总能那么精准地挑中各种变态男女的课然后被这些人折磨得死去活来[怒]	anger
2556	心里苦,说不出......	sadness
2557	今天下午小妹把她的婚纱照发了过来,幸福的笑容诠释着她的生活之美好.其实生活不管是何种方式,关键是幸福.	happiness
2558	啦啦啦......开心!!!!!昨天我的叔叔带我去玩了这个......[做鬼脸]	happiness
2559	幸福越容易得到,越容易失去	happiness
2560	上数学公开课地震,我只能说那老师跟我们没缘份...	sadness
2561	costco20多买了盒牛肉块,貌似被我炖坏了	sadness
2562	我想大概是因为我爱吃心太软所以才会心太软吧	anger
2563	这一天天地,躺着也中枪。。。就中我一人也就不说啥了,一中就中七个!!!	sadness
2564	眼睛好肿,又不得不起来,今天要去辞职,虽然过腻了每天自己在寝室的日子,但还是想辞掉这没有人情味的工作。给你[太阳]	sadness
2565	幸福就是只要牵对了手。就算失去了方向。也不会害怕。[挤眼]	happiness
2566	幸福不是房子有多大,而是房里笑声有多甜;幸福不是能开多豪华的车,而是开着车能平安到家;幸福不是爱人多漂亮多帅,而是爱人笑容多灿烂;幸福不是听多少甜言蜜语,而是在伤心时能有人对我说:没事有我在!	happiness
2567	下班了下班了!幸好写的script没出错	happiness
2568	每当无聊的时候你们都做什么	disgust
2569	嘿爸爸我今天又忍不住地对你发了脾气原因只在于你对我说了我不爱听的话我大喊大叫地连带摔门还好你不在气头上不然的话我俩又得干上一架真奇怪在亲人面前我总是尤其的敏感容易暴躁其实我知道我为什么会对你发脾气只因为我太像你而你总是看起来那么地孤僻浅薄观念封建而我也一样	sadness
2570	每次心情极度落魄的时候,不管是工作,感情,生活。都是你陪着我,骂我教我哄我直到我好了为止。我心情好的时候你第一个打电话和我分享比我还开心。这几天你和宝宝都生病了很辛苦,你说你偷着上厕所的时间给我打电话还自责说不能像以前那样陪在我身边。电话这头的我已经哭的不像样了~[泪][心]	like
2571	在家待两天就无聊了,要不8月回苏州考g吧?	disgust
2572	书报亭里坐着一对老人,老爷爷看书,而老伴招呼来往的旅客,可只要拿高处的书,他就站起来帮忙。也许岁月让他佝偻了背,但他仿佛年轻依旧,做妻子的依靠[睡觉][拜拜][挖鼻屎]	happiness
2573	幸福不喜欢喧嚣浮华,常常在暗淡中降临,贫困中相濡以沫的一块糕饼,患难中心心相映的一个眼神。	happiness
2574	很多人觉得不快乐,是因为总觉得过去太美好,现在太糟糕,而将来又太飘渺。	happiness
2575	社会真的挺复杂的,没几个心眼如何立足,越来越跟不上节奏了。我情商其实一点也不高,善良对待我,该是多么完美的朋友。	sadness
2576	广八路走起,鸡蛋灌饼、小汤包+梅子粉鸡排,吃完胖三斤的节奏真好!不过夜宵神马的还是少食为妙→_→今天起,早睡哦啦啦~~	happiness
2577	某只玩文明5,侵略了三个国家,扔了一颗核弹,最后作为和平使者赢得了外交胜利。	anger
2578	肠胃不好,不配当吃货。	sadness
2579	最近越来越不相信所谓的真爱了,这一个月来我看了不少耽美文但是却越来越不相信所谓的结局〔除了个别几个〕尤其是网配文,网配圈很乱也是大家众所周知的事情...昨天看到了一个帖子,楼主称自己对同性爱越来越反感了还说了很多关于自己身边发生的真人真事。	sadness
2580	现在的状态就是左手托腮,右手狂点鼠标,懒散中带着一丝忙碌[bm可爱]	disgust
2581	自己一个人的时候,思念便四面八方地渗透进全身,因为没有你就是空荡荡的世界。看到的都是灰色的,毫无生机可言。	sadness
2582	小时候不懂事,有一次和小伙伴玩耍的时候,不小心脑袋撞到了水泥地上,很疼,以为会傻了,就赶紧在心中默默的计算着10以内的加减法,随便算了几个都对了,心里就暗自高兴,还好没傻,就继续去玩了。	anger
2583	中午在考场附近的小餐馆吃饭,听到两个考生聊天。a:刚才xx告诉我鲁迅姓周!笑死我了!周迅是个演员好吗?真想拿一板砖拍他!b:嗯,鲁迅原名李大钊,浙江周树人	happiness
2584	有一个阿姨碰到我妈说你们家儿子有女朋友了么[衰]	sadness
2585	放学喽!放学喽!终于可以好好睡一觉了。又可以做做白日梦了	happiness
2586	什么是幸福	happiness
2587	从出生到现在,这二十多年,一直没富有过,财运不佳;毕业后又是事业不顺,朋友不多,生活还拮据,可是,总是会有那么一个被世人认定很优秀的,对我很好的人在身旁,这是不是就是我大大的幸福呢。	happiness
2588	姑娘你大腿瘦到45cm就别减了,太瘦了不好![亲亲][太开心][挤眼]	anger
2589	昨天打球搞到我的大腿了,好痛啊!	sadness
2590	sorry,我无意中知道了某人的秘密。何必瞒着我?何必伤害我?何必?勿施于人也。	sadness
2591	一个男生正在很认真的做着某件事情的时候,看到你经过,他挥起了他的手。[爱你][爱你][爱你][心]这样的男生是不是很帅,很令人感动?[思考]	happiness
2592	其实幸福很简单,饿了有吃的,困了有床睡,烦了能想开,无聊了有事做,伤心了有安慰,快乐了有可以分享快乐的人这就是	happiness
2593	【励志语录】1、大多数人想要改造这个世界,但却罕有人想改造自己。2、莫找借口失败,只找理由成功。(不为失败找理由,要为成功找方法)。3、世上没有绝望的处境,只有对处境绝望的人。4、每一发奋努力的背后,必有加倍的赏赐。5、没有天生的信心,只有不断培养的信心。	like
2594	小老虎对小兔子说“每次看到你我都很嘴馋怎么办?”小兔子咬了咬牙对小老虎说“如果你实在忍不住了,就请吃掉我吧。”“吃掉你?我为什么要吃掉你?”“你不是嘴馋吗?”小兔子问。“可我嘴馋是因为...”小老虎说着,朝小兔子脸上亲了一口。	like
2595	难倒有些人活着就是为了给别人带来负能量的么?不吐槽就会死星人	sadness
2596	馀则成:我能和你商量个事么。翠平:说。馀则成:你能生一个嘴小一点的女儿么?翠平:我还想生一个眼睛大一点的儿子呢!———这就是幸福吧,嘿嘿	happiness
2597	我穿着围裙为你做一顿可口的晚餐,再顺手把你换下的衬衫洗干净。黄昏时疲惫的伸个懒腰你自然得站在身后帮我捶背,出差归来时会买礼物放在床头。我不会强调自己的付出,但你会懂得我的所有辛酸不适,时光如白驹过隙,我们来不及海誓山盟,但内心早已说了千言万语的情话。	like
2598	我很努力我为了我想要的在努力我会成为更好的我否定曾经所有人对我的看法不管你看到看不到还是以为我3分钟热度都带着你的想法滚叭你是谁啊我认识你吗你又认识我吗好叭那只是过去颓废不堪的我你重新审视过新的我吗不过这不重要结果才重要等着看吧晚安	like
2599	工程部克我啊,每次婚礼的东西都要出岔子,让不让人好好工作[泪流满面][泪流满面]	sadness
2600	希望哥哥们平安无事,不然我这辈子都过意不去。其实我是最不愿意说这种话的,因为我说了也不算,说了也没用。当面我也说不出口,现在说什么都没有用了,只希望你们能尽快好起来、不要受苦!	sadness
2601	【远离快乐的14个因素】1、缺乏信仰。2、总是比较。3、对美好事物不感动。4、不懂施舍。5、不知足。6、焦虑。7、标准高,压力大。8、不敢坚持做真实的自己。9、得失心太强。10、单调与循规蹈矩。11、活得太闲或太忙。12、过分追求无益的快乐。13、情感受困。14、心灵封闭	happiness
2602	早上很早就出来,到超市买了傻老婆爱吃的些许东西,买了水果,专门到老地方点了傻老婆最爱吃的麻辣香锅。虽然很忙碌,但是心里美滋滋的!静静的等待着、思考着,突然想明白了很多,应该理解傻老婆,更加用心的去爱傻老婆![爱你][爱你]	happiness
2603	晚安,明天还得上班!不过嘛,新买了台显示器还是比较让人亢奋的!!!	disgust
2604	聊天[泪][泪][泪][泪]	disgust
2605	...这世界!哎!	anger
2606	小众,独特的东西	like
2607	多说对不起	sadness
2608	和弟弟啃雪糕,吃薯片,就是小小的	happiness
2609	漫漫长夜	disgust
2610	过去可能很多时候我都忽略了你的感受,	sadness
2611	真无聊[睡觉]	disgust
2612	好想说什么也没啥好说就是睡不着太多要不了又没法要的太多不想要又不能不要的	sadness
2613	一天天的过......我还没为明天做好打算!!!	disgust
2614	穿一天平底鞋脚起水泡不是一件开心的事早安	like
2615	李代沫[心]骨子里的我	like
2616	活着就一定会遇见好事	like
2617	热尔维尼奥到底是粉丝还是鱼翅啊。	disgust
2618	她生病了一个月	sadness
2619	:获得幸福的根本,并不在于你拥有了多少财富,而在于你减轻了多少慾望。🙏转	happiness
2620	【但是自然界也是有奇迹的,逆时针的两个人也会相遇】这句话讲的是女扮男装的铁t和男扮女装的伪娘之间的恋爱故事。	anger
2621	就是可以为了一个人推翻自己的所有标准。	like
2622	平淡的一天。安。	happiness
2623	每天喝近3l水,我容易吗我!都快灌死了!今天听师兄说,开水中加一勺糖和一勺盐,搅拌均匀喝下去,一天就见好!我试还是不试?它祖爷爷的!	sadness
2624	终于找到一个比我吃饭快的人咯	happiness
2625	刚刚吃了一块杏仁牛奶的kisses巧克力[打哈欠]突然觉得有哪里不对幡然发觉这块里面木有杏仁!![生病]	sadness
2626	:猛然间,很想念西安	sadness
2627	是我们来晚了,让您现在才吃到营养健康的养身顶汤。	sadness
2628	有时候突然就不想说话,就盯着已经黑掉的手机屏幕看,等到再按亮的时候,就已经自动忽略和我说话的人看小说去了	disgust
2629	一首《学不会》都不足以磨平我的高数滴创伤。爸,妈,不想回家了,。	sadness
2630	才下了眉头却攻上我心头	sadness
2631	希望你们,你们你们你们还有你们都很幸福。[玫瑰]	happiness
2632	7月16日赵建成从宝南锚地开“维多利亚”轮时,由于船方未提供符合imo规定的引航梯,而发生险情,赵建成及时取证,并将情况报告站调度,站为维护引航员的人身安全决定中止引航,在海事的协助下对该轮进行ps检查。赵建成这种对安全认真负责的举动,是安全引航,有尊严引航的具体表现!	like
2633	米啊叻,myself	sadness
2634	时刻提醒自己坚持啊💪💪✌✌✌	like
2635	对不起科比,我出生晚了[泪][泪]	sadness
2636	就是我一生下来就1米五了,之后整整十九年就长了1公分( д )ノ	sadness
2637	想你一生也爱我一个想你心意属我期望你跟我长路也走过	like
2638	20130912、20130919~都是结婚的好日子[呵呵],看着朋友们步入婚姻,能送上唯有祝福:爱长久!幸福长久![心]	happiness
2639	一个人,一辈子,总要悲一阵子,喜一阵子,聚一阵子,散一阵子,青春一阵子,美丽一阵子,沧桑一阵子,深沉一阵子,幼稚一阵子,成熟一阵子,烦恼一阵子,艰辛一阵子,痛苦一阵子,幸福一阵子。不管哪阵子,别忘了,不论你再丑再穷,总会有一个不嫌弃你的人,陪着你,不是一阵子,而是一辈子。	happiness
2640	嘻嘻。。	happiness
2641	幸福是欲望实现那一瞬间的感受	happiness
2642	路遥千里,难断相思。人虽不至,心向往之。无言又无语,若即又若离。	sadness
2643	敢不敢再疼痛一点	anger
2644	爱你。。。。	like
2645	飞机把你带走[飞机][飞机][飞机]你把我的心带走[心][心][心]	happiness
2646	想起了大上海某些画面当日军空袭过后成大器面对废墟声嘶力竭的喊着知秋转回头看见满是惊吓的知秋他们拥抱在一起跨越了生死一个是人妻一个是人夫而最后的结局那个用尽一声去爱大器的女人阿宝用自己的死最终换来了大器的爱是迟到了数十年的从不发现	happiness
2647	我想她了,想她的一切!	sadness
2648	小腿踝被蚊子叮了个包,抓流血了,这时yoyo慢慢飘过来,轻轻认真的帮我舔伤口...心里一阵感动“还是你知道心疼妈妈呀”,正意淫着呢,感觉不对,这货怎么越舔越重啊,正要制止,只见yoyo张着大嘴“嗷”的一声对着伤口就是一大口ᅲᅲ好吧,是我想多了,她不是在帮我疗伤,人家是在吃肉呢[黑线]	sadness
2649	昨天清晨太阳挺暖的,在阳光的照耀下,路旁的小道上有两个老人手拉手慢慢走着,时不时还相视一笑。。。。一种幸福感油然而生。。。。重点是被那两位老爷爷相扣的手萌到了。。。。	happiness
2650	就特么一傻逼给我的和别人都一样那我不特么稀罕本来就不应该高攀你	anger
2651	nmgbd。。原来是美男竟然被翻版。。我的天啊。汪东城竟然是黄泰京!!!!	sadness
2652	能见到你真好	sadness
2653	所以这特么是不被在乎的节奏?从来就不矛盾的两个人两件事你为什么非要二选一	anger
2654	完了...我好像喜欢上一个人了......我要想清楚!给别人讲的头头是道,一到自己这里怎么就这么乱!什么是喜欢呢?	like
2655	幸福是多样的,人人都可以拥有自己的幸福,关键在自己的感知和体会。	happiness
2656	奇迹,是不会在容易的道路上绽放的。也许,在所有不被看好,无人尝试的选择的背后,会有不曾见到的可能,不曾设计的未知。未知让人恐惧,引人好奇,也因此证明你的勇气,成就你的自信。在每个死胡同的尽头,都有另一个希望的天空,在无路可走时迫使你腾空而起,那就是奇迹。	surprise
2657	今天在成都电视台幸福3频道看了有话好好说栏目《幸福一家亲》情景剧的“酒醉吐真言”的一集,感觉非常感人,不仅故事写得好,而且演员演绎得也非常成功,全集矛盾冲突激烈,情绪丰富真挚感人。他们真是幸福的一家亲。值得推荐,建议电视台应有计划重播,让更多的观众看到。[嘻嘻]	happiness
2658	甜蜜日子可否再度重复	happiness
2659	为什么今年的老鼠,蚊子特别多?晚上蚊子都往脸上扑......	anger
2660	人生开始步入囧途,快疯了,是不是应该倚傻卖傻,过他娘的真心累啊!疯过骂过还得攥紧拳头拼老命。	disgust
2661	有一种爱在心里,有一种爱在表面,有一种爱在行动,有一种爱在嘴上.神马时候姐也能拥有这种爱呀!痛苦!!!	sadness
2662	一台定价只要27万,到岸价是30万的车,约要加17%增值税变35万,加25%关税变44万,商家留10万的利润,变54万,而消费税是价内40%,则至少定价90万才可以搞定,还要加购置税8万多。——就这样,别国只要27万就能买到的车,我们税后却花了100万!这难道不是剥削?只要你买东西,你就跑不掉。@[怒]	anger
2663	对不起亲爱的自己~让你过得如此颓废没有色彩~对不起各位~因为我~过得如此受累	sadness
2664	这样的分班名单就跟闹着完似的。	anger
2665	一天restart	sadness
2666	总觉得写作也应该是有道德的,而现实总是能将道德击得粉碎。过年前一天被爸妈相亲接受彩礼,因为不满被打,三十晚又被骂,初一晚又被打然后离家出走,主人公是位刚满16的花季女孩,本该拥有的是快乐,还有新年家的团圆,可是,何处还能容下这样一位女子[泪][泪][泪]	sadness
2667	和我爸通电话,聊到要出去玩儿的事。“你看,我总是宅在家里,我得出去走走啊,不能因为外面乱,就说哪儿都不能去啊,难道我还能在街上被拐走,是不?”“你还别说,我担心的就是这个。”	sadness
2668	我的宝贝宝贝给你一点甜甜	happiness
2669	出差在广州。过马路高空坠物砸进急诊;应酬喝茶杯子漏水烫到手;抽中短签早起排队买早点[泪]	sadness
2670	请在这里输入你想说的内容	disgust
2671	今晚逃课去看电影	happiness
2672	最讨厌乘车时有座位还要硬挤我的奇葩[怒][怒]	sadness
2673	:别让欲望把快乐挡在门外。	happiness
2674	关注我,关注后,有惊喜,你懂的!38	anger
2675	现在真是这种状况了,早上起床洗脸刷牙上会儿网,又该睡午觉了!(╯▽╰)	sadness
2676	我一定是要死了,所以才会这么无聊。因为人死了以后是不会觉得无聊的,趁现在还活着。	happiness
2677	早上有妈妈给我当人肉闹钟弟弟会把我拉起床还有爸爸不厌其烦地接送	happiness
2678	昨天没做梦,因为一晚上都在过敏[拜拜]。	sadness
2679	今天做了件最幸福的事帮老妈老爸他们染头发[爱你][爱你][爱你][爱你]还第一次给老爸洗头[亲亲][亲亲][亲亲]原来幸福很简单[做鬼脸][做鬼脸][做鬼脸]	happiness
2680	你感受到了没?	sadness
2681	擦。我刚才看见搜狗网页首页的新闻栏标题是:“消息称原发改委副司长熊必琳被查疑涉刘铁男案”、我第一眼以为刘轶男犯事了......那一刻我也清楚地感知到其实高考前采访时把我的名字念成“郭铁仙”是那么理所当然......	disgust
2682	淘到极喜欢的春装。	happiness
2683	有些事想多了头疼,想通了心疼。所以,想不开就别想,得不到就别要,干嘛要委屈自己。在多说无益的时候,也许沉默就是最好的解释。命里有时终须有,命里无时莫强求。生命毕竟是一个漫长的过程,每一寸时光都要自己去品尝和经历。决定你是否快乐的关键是你的心境,而不是你的遭遇。	happiness
2684	屏蔽所有关掉聊天窗口躲在自己的小世界里下起雨心房被狠狠拍打连声音都很沉哑无声雨依旧雷声太大不是你在哭泣吗哭不出来满面泪水想要寻找安慰都似以为你在开玩笑时间太长累了沉默不语是我让你为难了以后不会打扰我是一个人啊挺住别哭世上哪得一个他不计较好坏通通哭吧别留心房一寸地别动举起手来	sadness
2685	后悔也有	sadness
2686	火车票忘退了!	anger
2687	像千万只蚂蚁一样啃噬着我的身体	sadness
2688	[好囧]真的好可爱,真的真的好可爱,[抓狂]受不鸟了,	like
2689	和你处在同一位置体会同样一件事才知道原来是这种感觉。	sadness
2690	[1/2]-_-!我类个娘哎。我的第六感真是越来越准了。坐上回郑轻的小车才走我大脑就出现这个车撞住俩人的画面,赶紧摇了摇头。妈呀!谁知道到第二个十字路口的时候两人骑电车闯红灯还好我坐的这个车刹车及时没撞上,可是我右边的车咣当咔嚓的就装上了,我还在副驾驶窗户还开着,后面人直接撞飞了。	fear
2691	当发现自己那么在意的家人因为一个朋友而毫不为自己考虑的时候,多少有点失落	sadness
2692	看到月考成绩真的很想哭	sadness
2693	不是房子有多大,而是房里的笑声有多甜;幸福不是你能开多豪华的车,而是你开着车能平安到家;幸福不是爱人多漂亮,而是爱人的笑容多灿烂;幸福不是在成功时喝彩多热烈,而是失意时会不会有个声音对你说——朋友别倒下;幸福不是听过多少甜言蜜语,而是在你伤心时能有人对你说:没事有我在。	happiness
2694	如果可以不想各自奔天涯	sadness
2695	不管你留什么样的发型,我都觉得你是咱班最帅的男生。	like
2696	[1/2]暑假在帮�子寻找幼儿绘画班时接触了很多类似的培训班,拿了一堆宣传单回家,在仔细看了每个学校宣传简介及现场试听后,受栗子'性感营销'内容的影响,我觉得这些学校在个性突出,与目标人群的接触以及用户体验方面都做得很差,稍微好点的大型培训学校靠师资占稳市场,弱小的个体创业者却	happiness
2697	情人节情人节!我今天真的很幸福很嗨森呦!!![爱你][爱你][嘻嘻]啦啦啦......	happiness
2698	_------------------好吧我很无聊!所以想找人互粉!!	anger
2699	对不起,是我们太笨,只想踏踏实实做服务,不懂得去吆喝;对不起,是我们无能,没办法扫平回家路上的积雪;对不起,是我们没能力,只懂保车险不懂保天下尽欢颜。我们是大地车险,愿回家的人一路平安!	sadness
2700	[把男朋友电脑里他前女友的照片删了男朋友打了我我是不是该把他果断变前任但他兄弟告诉我他没打死你说明他爱你可是我总觉得哪里不对]	sadness
2701	我忘了还你橡皮忘了还你cd忘了还你小说集只是现在你在哪里我需要用全世界细节来想你[月亮][月亮][月亮]	sadness
2702	你麻麻的~臭死啦。。先生可不以穿回鞋子啊。[怒骂][怒骂]	sadness
2703	虽然姑姑走了,是种解脱,可是每当想起她,还是会泪流满面。对我最好的,除了爸妈以外的就是姑姑,我真的很爱她!你在另一个世界,一定要过的很好![泪]	sadness
2704	不是你送的芭比,不是你给孩子买的最新动画片,也不是你给他的一柜子衣服。幸福很简单,但真正的幸福有着深刻的内容,它能培养孩子的精神、与世界融合的感受将是他一生受用的财富。请你别忘了每天把这份礼物送给孩子。	happiness
2705	隔着望远镜爱上一颗星。和。我向往漂泊而你愿意陪伴。我觉得是说同一件事。	sadness
2706	几乎每天听一遍《寂寞的星期五》	disgust
2707	一包老坛酸菜面窝两鸡蛋加若干小青菜,居然没饱[哼][汗]	surprise
2708	拿着手机一不小心就刷屏了,好不容易开一次电脑却只是看看博,连一点转发的想法都没有。[蜡烛][蜡烛]	sadness
2709	突然,有点想一个人了,一个彼此都不够了解的人,好久没梦到你咯,淡淡的思念有点忧伤。如果再梦到,问候一句:好久不见	sadness
2710	电脑里无线连接和宽带连接都木有了,这可咋整··囧......	disgust
2711	手机坏了呜呜谁买一手机送到城启1106啊[转发][偷乐]	sadness
2712	求你,打车滚!	disgust
2713	[汽车][汽车]等我回来啦天气好晴朗处处好风光[话筒]	like
2714	有些话就是那么刺耳,确记得最深。我应该选择删除![挖鼻屎][挖鼻屎][挖鼻屎][挖鼻屎]	sadness
2715	翻以前的照片最大的变化是头发长长短短头帘时薄时厚于是有人站出来说嘿我喜欢你中长发的时候可又有人说你薄流海好看啦最后他说恩不过你所有样子我都爱这岂不是很好?	like
2716	有时发觉不爱学习的原因不是没有买点读机哪里不会点哪里,而是学习的时机不对。一是不能指望在想学习的时候,环境像图书馆一样安静,二是不能指望在图书馆的时候想学习。	sadness
2717	昨天今天天天犯困看书效率极低最近压力真的好大啊痘痘又在疯狂的冒身上也没得钱了各种不爽啊	sadness
