3751	回家来妈妈就对我实行了圈养政策,从学校的一天两顿半坚持每天运动到现在的一天四顿半没有半点运动,脂肪又开始肆虐了。又想去游泳了,但是明显办游泳卡我不划算啊,动不动就是一百两百次还一年内不退过期作废,你以为我假期有多久呢。听说花果园有个无边泳池,看起舒服,可室外泳池我才不去呢。	disgust
3752	又忘记了.........还能不能一起愉快的玩耍啦!?	anger
3753	加油唱吧[哈哈][哈哈][奥特曼][奥特曼]希望有个好成绩[挖鼻屎]	sadness
3754	眼泪滴滴答答地滑下来,好像满头的雨点。	sadness
3755	周四啦~啦~啦~	happiness
3756	我说,这个图真的改不了么?他说,改不了。我说,哦,那算了。他说,咦,你现在进步很大嘛!这个趋势很好,要保持,再这样发展下去,你找对象就容易多了。	surprise
3757	《第五十次求婚》、《人生遥控器》	happiness
3758	打廖两个喷嚏系不系要感冒廖	sadness
3759	作文42?!哈,yy同学,你真的可以去死了。	sadness
3760	运动会的时候在主席台上我吃完kfc你边抱怨我说怎么吃成这样边给我擦嘴	happiness
3761	麻麻做饭,豆宝依旧站在小椅子上,洗洗菜,玩玩水,过家家玩具小碗放在洗菜池那一边,小手伸着够了三次还是没拿到,豆妈拿过来放在手边,豆就玩玩呗,全程豆和妈都无交流,数十秒后,豆冲麻麻"妈妈,谢谢",同时将小脸凑过来,亲麻麻一下[亲亲][抱抱],瞬间麻麻那叫个感动,开心啊[哈哈]	happiness
3762	我幸福,你们幸福吗?????我幸福是因为幸福存在。。。。。。。	happiness
3763	心里堵着睡不着	sadness
3764	如果北大宿舍有专制打扫宿舍清理堵塞下水道那抱歉墨尔本没有,如果北大没有专制保洁那墨尔本更不惯毛病了。不会合租可以独居或者gc,不适应国外更好办祖国母亲在召唤你!	anger
3765	“皇上,郑和偷看奴家洗澡~55555~”“妈的,快来人把郑和这淫贼的小鸡鸡砍了!”侍卫砍了皇上的小鸡鸡,然后问:“淫贼在哪?”	happiness
3766	永远不要对一个花心的人不舍	disgust
3767	事情全部凑一块了[猪头]......有些东西一经参和感觉就变质了~	anger
3768	看个电影,花40块享受包场服务,爽爆了	happiness
3769	洗完脸仔细数了下红肿的痘痘和已经不明显的鼓包。。。竟然有二十个。。。。难怪遮瑕膏这么快见底了	sadness
3770	今晚邻居初三小孩问我一道数学题,关于圆和三角形,弄了半天终于解出来了,顿时觉得智商拙计啊!接着看单车和bbc玩dota水友赛,笑料...	surprise
3771	还是想念在学校里的日子'还记得老地方嘛'还有那条来回走的路呀	sadness
3772	[悲伤]也许我真的是个外星人,我总感觉我活在自己的世界里,别人说的东西我都不懂不理解,搭不上话。。。似乎我就是个局外人,尤其看着身边的人都在为自己的以后在打算着,尝试着的时候,而自己总想着要开始啦要开始准备啦,可是却没有任何行动,腻在一角似乎从没离开过前进过一样😔😔	happiness
3773	..............................我为什么要看房产广告......房子们都那么漂亮!!!又那么贵!!!!辛苦存钱到现在不过也就买个几平米连一个厕所都不够qaq......【默默看向彩票【←出息呢!!!	sadness
3774	小吃街没有了再也不能买你喜欢的烤玉米了	sadness
3775	就在我打算买个新唇膏时,找到了![耶]	happiness
3776	有你的每一天,美好、充实。【心】	happiness
3777	野心太大	sadness
3778	疲惫的进门倒在床上的瞬间发现堆放满床满地的资料,书籍占据了我的容身之地,放空之后在反思我究竟是律师呢还是企划总监and演艺经纪人呐??搞得自己每天吃着合同,资料,文件过活,不吃不喝也乐呵呵,眼睛在打架,晚安[兔子]	happiness
3779	又要开学了,上学好烦,不过既然上学就因该好好的上	sadness
3780	七点半反胃而醒,上吐下泄,撑到公司继续上吐下泄。。。。有绝食的想法了。看来朝天门也不咋样,还那么贵。	disgust
3781	又是一个星期五咯,哈哈......	happiness
3782	人生最幸福的事:父母健在,自己夫妻恩爱,儿女可爱,知心朋友抬爱,亲朋好友能够互相关爱。其他都不重要,别太计较。	happiness
3783	xxx居然也选乒乓也	happiness
3784	你妈妈好起来	like
3785	东西又找不到了,这种感觉真烂[生病]大夏天好讨厌	disgust
3786	无聊的要发霉了。。。。。	disgust
3787	做了个梦,梦见有个人跟我讲说有个办法让我直接一步飞跃成角虫,我想了想拒绝了,因为我在真正面对这个问题的时候才发现其实画画一个有意思的地方在于再练习之中不断进步,如果直接变成角虫岂不是很无聊[拜拜]醒来以后我觉得我想太多了	anger
3788	我有个毛病:喜欢吹牛,即便这使我陷入困境或麻烦中,也没能改掉。	like
3789	你是听见了我今天说的话了是吗我可以说我今天说的话都实现了吗[月亮]	happiness
3790	夜深人静就变得感性,想念妈妈,不禁流泪,这种感觉大概就是母女才有,不会告诉妈妈我想她,因为那样她会比我更难受。回味那一起无聊的日子。	sadness
3791	,深夜,又一次想起了杳无音讯的徽,不管过去多久	sadness
3792	我要改变世界,改变自己	happiness
3793	好的女子是用成熟的想法做天真的事,心里放荡身体纯洁。[good]	like
3794	这几天闲又看看这部电视剧虽然有点儿旧了时间有点儿久远了但是感觉还是好看还是有说不出来的感觉现在看着夏琳还是觉得她特好看特喜欢	like
3795	幸福就是,找一个爱的人,找一条路,牵着手走下去,直到地老天荒。	happiness
3796	搭车劲想呕于是提前落车我勒个去啊无力走路回到家直接趴床妈妈心疼死了本来弄了一大餐丰富的饭菜给我然后我说想吐想吃面又忙乎乎的跑厨房我睡得迷迷糊糊妈妈把我叫醒慢慢扶起我一口一口喂我我说不用了我自己吃她说:妈妈喂的特别温暖!吃完之后又强迫我吃药喝了几杯水我知道她爱我。	happiness
3797	又到了一个人无聊的时候啦自己跟自己玩那今晚就玩飞行棋吧唉	disgust
3798	昨晚知道大学同学和老婆一起突然离世,一直胸闷,说不来的悲伤。一直觉得生活不容易,可是生死有时候真的不是一个人的选择。不好意思今天把情绪带到单位,让她们跟着难过很久。一想到看到的画面就感觉到当时有多无奈和挣扎着求救,眼泪就开始不听话了。	sadness
3799	milannews的消息,米兰预备队的斯洛文尼亚中场赞·贝内迪西奇成为本届维亚莱乔杯比赛的最佳球员候选热门之一,18岁的贝内迪西奇在3场比赛中打入3球,另一名候选热门是帕尔马中锋阿尔贝托·切里,他在本届比赛打入6球。	like
3800	11爸爸一次重病,在床上躺了大半个月都没醒,后来在一个下午突然醒了。醒来时他嘴一直在动,妈妈把耳朵凑近了对他说:“你慢点说,我听着呢。”爸很虚弱地说:“女儿该放学回家了,你去把饭做了吧	happiness
3801	我认识的每个人至少梦帆高扬可能谁也担顾不着对方了行星轨迹可能一撇就此难见吧	like
3802	每一天,都在混日子!18年的时间就这样浪费了!幸好我还有时间去努力!去拼搏,去奋斗,只为了最初的梦想!(我要成为医生,只是为了不想再有最心爱的人死在身边却不能做什么了)晚安!训了[月亮][睡觉]	like
3803	大凡结婚是喜事,可要是把它变成某个人的私欲。那就恶心至极。我也参合进来了。我都觉的我恶心。难道不是吗?算了不提了。。。。	disgust
3804	今天突然接到你的电话,有点惊讶,但幸好,你还会打我的电话。	sadness
3805	幸福是个比较级,要有东西垫底才容易感觉到。	happiness
3806	无聊吖[泪]	disgust
3807	简单生活才能幸福生活,人要自足常乐,宽容大度,什么事情都不能想繁杂,心灵的负荷重了,就会怨天忧人。要定期的对记忆进行一次删除,把不愉快的人和事从记忆中摈弃,人生苦短,财富地位都是附加的,生不带来死不带去。	happiness
3808	想您们了家里的两位老人[可怜]	sadness
3809	开心哦!昨天感觉不错,今天感到更好了,眼看我的感冒就要好了!心情大好!亲~晚安!	happiness
3810	她说,明天就当是聚会吧,该怎样就怎样。	surprise
3811	好多次事实证明,我唔系“大家”中嘅一员.文字功力唔够,表达唔到我哩家嘅心情.网络上真系好多教坏人嘅名言,我应该早早听取佢嘅说话.只有土豪可以同土豪做朋友.我哩个穷屌丝都系缩埋角落头卖火柴啦.[蜡烛]	happiness
3812	人不逼自己一把,就永远不知道自己有多优秀。	like
3813	——社会主义制度的优越性在哪里?——成功地克服了在其它社会制度里不会存在的困难。	happiness
3814	每天都期待可以与你相遇	like
3815	为什么去奋斗呢?很简单,每一个人都在奋斗,在竞争,奋斗是必然的,能让我们更好的生活着,奋斗是一个人生存的意义,一个人的人生如果不奋斗,那么人生就没有价值了,奋斗能给我们很多东西,荣誉,金钱...让你的人生更有价值啊,每一个人都必须为自己的生活奋斗,这是常识。	like
3816	对不起,真的对不起。活着真是件疼苦的事情,活在别人的悲伤里。感慨自己的渺小无助。小孩子对不起。我没钱。有人。	sadness
3817	【我喜欢】我喜欢,每天电话里传来熟悉的声音,尽管,我们在城市的两端,尽管,只是简单的“吃饭了吗”,尽管,这是在普通不过的事。都说陪伴是长情的告白,那么始终如一的关怀是否是最甜蜜的幸福呢?一杯温白开水,一颗巧克力,一包吐司,一台单反,我喜欢,就够了。	like
3818	排舞比赛就是广场舞比赛,原来最炫民族风那么白搭,男生也可以跳广场舞的还是穿着正装跳的blabla...无尽的吐槽...	sadness
3819	如果有一天,让你心动的再也感动不了你,让你愤怒的再也激怒不了你,让你悲伤的再也不能让你流泪,你便知道,这生活给了你什么,你为了成长,付出了什么。	sadness
3820	深夜来一些凉快的西瓜[西瓜][西瓜][西瓜][哈哈]![偷笑][酷]爽就一个字...我只说一次😱😉过瘾啊哈哈哈哈哈[嘻嘻][偷笑][鼓掌]	happiness
3821	最近这偃高南苑15级一楼全民男神张佳宾也不来找我了,不想一块愉快的玩耍了?了?	disgust
3822	对不起唐老师,作文真是在扯,边城完全没看。地理组真是业良,选择题60道,感觉及格无虞,谢谢侬。[泪]	sadness
3823	在帮忙翻两张签证表看了看发现在帝都生活好艰难...一个是中国政法大学毕业武大博士人大博士后现在月薪7829...另一个是人大毕业世界海事大学研究生月薪8000...俩人都参加工作二十多年了...	sadness
3824	我很庆幸出生于现在这样一个家庭即使不是官二代富二代但爸妈也给了我他们能力范围内最好的生活可能我还用不起最新的电子产品买不起所谓的奢侈品但也有足够的钱让我可以出去玩玩比起有些花着父母的钱却看不起别人的人我宁愿自己努力改变生活	like
3825	闲的时候不知做什么忙了又烦躁	disgust
3826	主人设置了权限,您可通过以下方式访问。	anger
3827	客户关系不到位...我努力去做,可是还不能做到位。我想做好...但真的好难!	sadness
3828	从来没有那个工厂过安检,把皮带扯下来...	anger
3829	坐着通向远方的客车,也许我会一年后再回来,希望那时我是带着胜利的果实回来的。全力以赴2014!	like
3830	很安静的情况下吃东西发出声音。	anger
3831	我还不想恋爱。有人说每一个不想恋爱的人都是“心里有座坟、住着未亡人”,此言非虚。我虽“名”草无主,却心有所属;虽然流水无情,但落花有意。有时候爱情就像便便,要来是自然而然的事情;有时候爱情就像便便,努力了很久却只是一个屁;有时候爱情就像便便,水一冲就什么也没有了...	sadness
3832	像的意思就是终归不是真身	surprise
3833	杨晓芸说:我真不想长大,不想工作,我就愿意留在学校里面上学!	like
3834	就是现在,超级幸福,我有着最棒的家人,希望爷爷奶奶健健康康的。	happiness
3835	“乌溜溜的黑野猪和你的小脸”......听起来好耳熟呀[猪头]	disgust
3836	现在的我很快乐,且行且珍惜	happiness
3837	大家好!我回来了!我的户口回来了!好开心!!!![泪]	happiness
3838	最真实的态度对待自己,最相信的态度相信幸福,最坦率的态度对待过去。晚安。	like
3839	原来没有29号~~~~(>_<)~~~~	surprise
3840	我的人今天晚上不理我。可能是气我晚上没有跟她出去,[委屈][委屈]以后不会的,一个情人节算什么,	sadness
3841	老师讲衍生品特别快,我觉得他大概是这么想的:反正讲得快也好慢也好,你们都是听不懂的。那不如讲快点,大家都不那么痛苦。	like
3842	尼玛该死的!!!!!!!!!!!!!!![猪头][猪头][猪头][猪头][猪头][猪头][猪头]	anger
3843	相聚总是那么	happiness
3844	刚去网吧打开游戏结果一个黑影拍了拍我的脑袋以为是哪个认识的朋友猛然转头果然是我一辈子忘记不了的脸放梅[泪]	sadness
3845	跑到建行问人家,为什么我的卡前些天显示还有xx数额我没提过钱现在只剩下x啦,坐在外面的应该也是一个工作人员没好气的说:你拿的也不是建行的卡啊!我一看,我手里拿的是中行卡[抓狂]	disgust
3846	在学校吃个米饭,需要要几个菜,真不认识什么芹菜西葫芦什么什么什么的总是这个那个还有那个今天那人真不知道我说的是哪个我只好说豆腐左边的下边那个菜[汗]	anger
3847	有些人连自家说相方是好男人也能累不爱的,真好奇之前眼里萌的cp到底是啥样的	happiness
3848	当每天早晨醒来我多么希望看到你那张熟悉的脸嗅着你的发香,可是空旷的房间你我曾经躺过的地方只有我孤独的数着寂寞。。。。	sadness
3849	吃什么丑?藕。因为吃藕丑。为什么吸烟?因为吸烟~仙。为什么不戒烟?因为戒烟~贱。最美不过夕阳~翔	disgust
3850	有人问小怪兽:"奥特曼总是欺负你你,你不疼吗?"小怪兽挠挠头说:"疼。"那人又问:"为什么不离开他呢?"小怪兽用小爪子拍拍心口,傻呼呼笑:"那样会更疼。"幸福就是猫吃鱼狗吃肉奥特曼打小怪兽。	happiness
3851	我吃完饭作死的在床上打滚,躺平了打算来一个鲤鱼打挺,结果忘了我自己当时是横躺着的,头不负众望地磕到了墙壁。	sadness
3852	因为太温暖因为不断累积情绪不小心控制不住眼睛爆了	sadness
3853	...就像一滩无漾的水。[悲伤]	sadness
3854	成成爱的草莓已经上市了,外婆怕不好吃先只买了一点试味,洗了一部分结果味道挺好,成成吃个不停,最后两个外婆说要他留一个给妈妈,他选了大的那个留个我。可是还是很想吃,过一会过去闻一下,舔一舔,但忍住没吃。我一回家马上献宝样的端给我[太阳]	happiness
3855	手也差点弄了包的了	sadness
3856	双十一想在淘宝买双鞋子,却发现寄过来太麻烦,简直心塞,台湾我们还能友好地玩耍吗?	sadness
3857	今天就要开始讲课了	fear
3858	就让我们保持这样的关系'想听你声音可以打电话给你'身体不舒服可以向你撒撒娇'可以嘛'--李龙	sadness
3859	一大早的就在床上,压(呀)!土豆[馋嘴]。。。	happiness
3860	我是高大威武,体育巨好,一巴掌把人丢到十万八千里的超人。	happiness
3861	我名字笔画多,而且难写不常见。所以......幼儿园的时候爸妈教我写名字,写的是:代一尼。小学的时候爸妈教我写名字。写的是:戴一妮。然后待我三四年级左右,才教我写的是:戴旖旎。辛苦你了,皇阿玛皇额娘!	happiness
3862	用了好几年的碗被打破了还是会有点小伤感呀没办法谁叫我恋旧勒	sadness
3863	家后门死了一个狗狗[悲伤][悲伤]	sadness
3864	以前该学习的年纪谈恋爱现在到了该恋爱的年纪却要更努力的学习	sadness
3865	梦醒来就能实现	happiness
3866	有爱一家人不错看[赞]	happiness
3867	生活似乎渐渐戒掉我对书籍的渴求	fear
3868	亲戚么?只不过是存在点血缘关系罢了。	disgust
3869	蕃茄是鸡蛋的[太阳]	happiness
3870	我要疯了,为什么学校的板凳让我浑身都难受!!!![抓狂][抓狂][抓狂][怒][怒][怒]	anger
3871	幸福其实很简单,那就是能够躺在我爱的人身旁,看着他做一切无聊的事。。	happiness
3872	我要杀人,惹我者死	anger
3873	动我网线者死	anger
3874	我把月亮戳到天上,天就是我的。我把脚踩入地里,地就是我的,我把唇压进你的脸庞,你就是我的。	happiness
3875	妈的,哪知禽兽乱丢西瓜皮。	anger
3876	苍白无力。	sadness
3877	我最喜欢的两个段子手,一个开始麦麸,一个压根不更新了。我最喜欢的萌妹子居然是个男的!!!!!	sadness
3878	【因为篮球我结识了许许多多可遇不可求的朋友和故事。这些都是无法追寻到的土豪般的财富】	happiness
3879	“我找男朋友的要求并不高,只希望我俩走在街上人们都会感慨:这男的怎么会看上她?”[笑哈哈]	happiness
3880	是我无能,腹黑可以,天然呆不行。	sadness
3881	我还是会相信,相信感觉,相信简单。	like
3882	幸福绝对不是奢侈品,它一直都在,知识有些人没有用心去察觉。幸福本身就是生活中的点点滴滴,任何能让人感到轻松和快乐的东西都是“幸福”!于苍白的世界中看见斑斓的色彩,于平淡的生活中活出自己的精彩,就是这么简单!	happiness
3883	哥哥的女朋友突然说要带我去逛街,我跟她只见过一面,又不是很熟。我想问,怎么才能装作很熟的样子跟她逛街才不尴尬呢?[委屈]	disgust
3884	现在流行暴力流?![吃惊][吃惊]	happiness
3885	哎'又不想聊了'发扣扣又不回'她怎么那么倔啊'比我还狠噢'不过还是知道她会想我发短信过去'好吧'允许人家红薯倔'等下就发[亲亲]	sadness
3886	其实我不想睡,其实我还想看你演的电视剧,但我还要上课啊。晚安了敏镐。	sadness
3887	[草泥马][草泥马][草泥马]	sadness
3888	早上710醒了,但就是起不来[泪][泪][泪]拖沓到9点才把心一横,10点到的图书馆......看来昨晚上睡眠实在不怎么样啊![衰]下午晚上都是课,捉急唷[打哈气][委屈]	sadness
3889	在那年的那天,我对你说“我走了”,在今年的今天看到站在门外的你	sadness
3890	晚安重庆[月亮]	like
3891	就是肚子饿有人送来我吃	happiness
3892	有自己的房子、车子不用为生活所愁每天都充实的过着和家人快乐生活!	happiness
3893	假如人生不曾相遇,我还是那个我,偶尔做做梦,然后,开始日复一日的奔波,淹没在这喧嚣的城市里。我不会了解,这个世界还有这样的一个你,只有你能让人回味,也只有你会让我心醉。假如人生不曾相遇,我不会相信,有一种人可以百看不厌,有一种人一认识就觉得温馨。[g思考]	sadness
3894	思念是最好的,想到你曾经高兴的一瞬间我就能高兴好多天,从不会让你记住我的不好,因为在你面前我努力做到了最好。	sadness
3895	随口一说,被认真对待。	happiness
3896	记得有次张卫平解说,这是姚明的最好时机,奥尼尔老了,邓肯也蹦不了几年了,结果。。。。。。。	happiness
3897	恶心他妈给恶心开门,恶心到家了。%恶心偷东西,贼恶心。%恶心开party,(聚)巨恶心。%恶心办身份证,还真恶心人。%恶心吃咸菜,还嫌不恶心?!%恶心吃了八大碗,真够恶心。%.........请继续	disgust
3898	最幸福的事儿就是办公室老师全去开会了,剩我一个超自由。[笑哈哈]	happiness
3899	谷歌像扔破鞋一样,轻松人掉gr。结果却有一堆的小兄弟在旁边接着,抢着!这真是朱门酒肉臭啊	surprise
3900	嫉妒真的让人红了眼,这滋味真不好受。。。	disgust
3901	楼上装修那兵兵乓乓德敲打声让人炒鸡抓狂😠😡👿,觉得自己都是个木脑袋鱼了...头疼死了,物业管他,他就消停个半个小时接着来~周末,都是大家睡懒觉德美好时光就被他这样亲手毁了,要么没素质要么就是愤世要么就是蛇精病。你看吧,总会有人上来治治你的,姐姐不陪你玩了,你就慢慢折腾吧。	anger
3902	有一个人在身边原意为你付出会时常挂念关心你不轻易说离开便已是万幸又何须去强求那样不可靠的爱情记住那个人留给你的感动并懂得回报才是幸福的@我们丢过梦想忘过信仰却故作坚强	like
3903	今天晚上在西铁上了久违的晚自习。。。[哈哈][哈哈][哈哈][嘻嘻][嘻嘻][嘻嘻]很开心的类。。。[鼓掌][鼓掌][鼓掌]	happiness
3904	如果全世界我也可以放弃至少还有你值得我去珍惜而你在这里就是生命的奇迹也许全世界我也可以忘记只是不愿意失去你的消息你掌心的痣我总记得在哪里我们好不容易我们身不由己我怕时间太快不够将你看仔细我怕时间太慢日夜担心失去你恨不得一夜之间白头永不分离[心]这首歌还有你的西瓜头	like
3905	我明天该怎么办。[失望]	anger
3906	下班回家途中想到了蓝可儿的视频,说实话我真的很怕[泪]	anger
3907	最近和一些很幸福的人一起同行,无限欢喜宁静	happiness
3908	谁能明白我所承担的痛苦...............!!!!!!	happiness
3909	不联系之后就删掉了	like
3910	群众上访说明他们有冤屈,群众有冤屈说明地方政府不做为,乱做为,再说群众上访是对中央领导抱有信认和希望,希望中央领导不要让群众的信认和希望变成了	sadness
3911	幸福其实很简单,就是在家听外公外婆讲那些年的故事[嘻嘻][嘻嘻],	happiness
3912	又是一大堆作业!无聊,又要背诵,无影!	disgust
3913	我就是临时来求个民工而已。明天(就是初五啦~)上午求民工,出夏目,因为东西比较多所以跪求民工,反正明天米娜也不过情人节,那就出来和我玩儿吧,我有糖!><【其实应该是这样:po主诚招萌妹儿共度情人节2333】	happiness
3914	如果你很幸福,半夜的简讯我就不需回复	happiness
3915	人就这么一辈子,开心也是一天,不开心也是一天,所以你一定要开心。人就这么一辈子,做错事不可以重来;碎了的心难再愈合,所以你一定不能事后后悔。人就这么一辈子,过了今天就不会再有另一个今天;一分一秒都不会再回头,所以你一定要珍惜每分每秒。	happiness
3916	[钟]未知也许是一种动力,诱惑了你奔跑,蜕变。	like
3917	深夜辗转,有缘读到些文字,细腻柔和之中是一点不示弱的勇气,自己的烦恼也豁然开朗,而我总算明白,内心真正的谦卑完满要经历怎样的挣扎、囹圄、突破、重生。最爱她的那句:“所以,你看,上帝从来不会永远地弃绝你。就是因为爱,他才允许各样的苦难临到你,让你最终寻到更好的自己。”	happiness
3918	显示屏,我不该认识周烦艺,这样你还是好好的。	sadness
3919	happinessliesintheconsciousnesswehaveofit.幸福在于自知拥有幸福。	happiness
3920	出门不带钥匙,开一次锁两百五不讲价[衰][衰][衰][生病][生病]进到屋里全是屎味...	sadness
3921	能不能不去考试总觉得自己懂的只是那么的一点好想逃离这世界[泪][生病][悲伤][失望]	sadness
3922	如果你看见我是怎么腐朽的你就不会爱我你说在一起就好了那不是真的我已飞快地坠落	disgust
3923	[1/2]是啊!对不起这三个字说出口非常很容易,一旦事情发生了被知道了就说对不起,如果说出能改能算数的话,那就没有对不起,不要说出了对不起等过了一会儿又忘记,他还是一次又一次的对不起,接受了他这么多次的对不起,他却依然不知自己错在那里,还口口声声说是压力所逼,她最爱的人所逼,	sadness
3924	无聊的时候你在干嘛突然好讨厌微信老是看你微信在线你以前看我玩qq游戏会说一起玩我知道你喜欢玩三国杀我花了一个通宵学会了英雄杀都是差不多的吧呵呵突然觉得我好卑微[失望]	disgust
3925	有人计算过,每个人的一生平均有八分之一的时间在寻找不知道又有多少时间被人用来等待。我想人生用于等待的时间远比寻找长得多,因为等待的时间可以和其他任何时间粘在一起:你可能正在做一件事,但是却在等待另一件事;你可能和一个人泡在一起,但同时却等待另一个人。——《阿司匹林》	like
3926	就多多看书充实时间,空间。	disgust
3927	我妈买德国,我爸买阿根廷,然后他们说不管谁赢,我们都会赢钱绝不会亏😂......	sadness
3928	好像溺水了一样,不停地抽搐着。连话都无法说得完全,只有不断加深的窒息感。	sadness
3929	~~~~~~~~~打雷居然直接把调节器打坏了!!!我的毛爷爷啊又出去了100!!!!!!!!!!	sadness
3930	又撞到手肘,顿时又感受到了绝望了呢。。。	sadness
